{
  "$schema": "https://json-schema.org/draft/2020-12/schema",
  "$id": "https://noxinfluencer.com/schemas/codex-plugin-manifest-v1.json",
  "type": "object",
  "additionalProperties": false,
  "required": ["name", "version", "description", "author", "skills", "mcpServers", "interface"],
  "properties": {
    "id": {"type": "string", "minLength": 1},
    "name": {"type": "string", "pattern": "^[a-z0-9]+(?:-[a-z0-9]+)*$", "maxLength": 64},
    "version": {"type": "string", "pattern": "^(0|[1-9][0-9]*)\\.(0|[1-9][0-9]*)\\.(0|[1-9][0-9]*)(?:-[0-9A-Za-z-]+(?:\\.[0-9A-Za-z-]+)*)?(?:\\+[0-9A-Za-z-]+(?:\\.[0-9A-Za-z-]+)*)?$"},
    "description": {"type": "string", "minLength": 1},
    "author": {
      "type": "object",
      "additionalProperties": false,
      "required": ["name"],
      "properties": {
        "name": {"type": "string", "minLength": 1},
        "email": {"type": "string", "minLength": 1},
        "url": {"type": "string", "pattern": "^https://"}
      }
    },
    "homepage": {"type": "string", "pattern": "^https://"},
    "repository": {"type": "string", "pattern": "^https://"},
    "license": {"type": "string", "minLength": 1},
    "keywords": {"type": "array", "uniqueItems": true, "items": {"type": "string", "minLength": 1}},
    "skills": {"const": "./skills/"},
    "mcpServers": {"const": "./.mcp.json"},
    "interface": {
      "type": "object",
      "additionalProperties": false,
      "required": ["displayName", "shortDescription", "longDescription", "developerName", "category", "capabilities", "websiteURL", "defaultPrompt"],
      "properties": {
        "displayName": {"type": "string", "minLength": 1},
        "shortDescription": {"type": "string", "minLength": 1},
        "longDescription": {"type": "string", "minLength": 1},
        "developerName": {"type": "string", "minLength": 1},
        "category": {"type": "string", "minLength": 1},
        "capabilities": {"type": "array", "minItems": 1, "uniqueItems": true, "items": {"enum": ["Read", "Write"]}},
        "websiteURL": {"type": "string", "pattern": "^https://"},
        "privacyPolicyURL": {"type": "string", "pattern": "^https://"},
        "termsOfServiceURL": {"type": "string", "pattern": "^https://"},
        "defaultPrompt": {"type": "array", "minItems": 1, "maxItems": 3, "items": {"type": "string", "minLength": 1, "maxLength": 128}},
        "brandColor": {"type": "string", "pattern": "^#[0-9A-Fa-f]{6}$"},
        "composerIcon": {"type": "string", "pattern": "^\\./"},
        "logo": {"type": "string", "pattern": "^\\./"},
        "logoDark": {"type": "string", "pattern": "^\\./"},
        "screenshots": {"type": "array", "items": {"type": "string", "pattern": "^\\./assets/.+\\.png$"}}
      }
    }
  }
}
