{
  "name": "noxinfluencer",
  "version": "0.1.0",
  "description": "NoxInfluencer marketing workflows through MCP.",
  "author": {
    "name": "NoxInfluencer"
  },
  "homepage": "https://www.noxinfluencer.com/",
  "repository": "https://github.com/NoxInfluencer/skills",
  "license": "UNLICENSED",
  "keywords": [
    "noxinfluencer",
    "influencer-marketing",
    "mcp"
  ],
  "skills": "./skills/",
  "mcpServers": "./.mcp.json",
  "interface": {
    "displayName": "NoxInfluencer",
    "shortDescription": "Use NoxInfluencer marketing workflows through MCP.",
    "longDescription": "Connect to NoxInfluencer through its remote MCP server to discover creators and work with influencer marketing plans and operations.",
    "developerName": "NoxInfluencer",
    "category": "Marketing",
    "capabilities": [
      "Read"
    ],
    "websiteURL": "https://www.noxinfluencer.com/",
    "defaultPrompt": [
      "Show my intelligent marketing-plan tasks.",
      "Show the next page of my intelligent marketing-plan tasks.",
      "Open my intelligent marketing-plan tasks in NoxInfluencer."
    ],
    "brandColor": "#FF5A36"
  }
}
